<?xml version="1.0" encoding="UTF-8" ?>
<table xmlns="https://github.com/dqinyuan/fakerpp"
       xsi:schemaLocation="https://github.com/dqinyuan/fakerpp
       https://raw.githubusercontent.com/dqinyuan/master/fakerpp.xsd"
       xmlns:xsi="http://www.w3.org/2001/XMLSchema-instance"
       name="shop" num="3" virtual="true" ds="">
    <col-families>
        <str len="3" prefix="Shop_">
            <cols>
                <col>name</col>
            </cols>
        </str>
        <str len="3" prefix="Owner_">
            <cols>
                <col>owner</col>
            </cols>
        </str>
    </col-families>
</table>